BOYNAME     |      RELATIONSHIP      |       GIRLNAME       |       DATE       |      TIME
--------------------------------------------------------------------------------------------
JVLEGPR    commited to   LHBATKP     on  10/04/2017   at   04:13:23
EOWUNYJ    commited to   PJHOVBY     on  10/04/2017   at   04:13:23
BCITEAN    commited to   UTRBVGN     on  10/04/2017   at   04:13:23
YRYYXFL    commited to   HQJPWCV     on  10/04/2017   at   04:13:23
QMIMGHC    commited to   VNHRALF     on  10/04/2017   at   04:13:23
BHWQUED    commited to   FJECEUF     on  10/04/2017   at   04:13:23
CQNPJUX    commited to   BQBIUOH     on  10/04/2017   at   04:13:23
AXNTUGW    commited to   IGTHWNS     on  10/04/2017   at   04:13:23
